{
  "$schema": "./reference-replication-profile.schema.json",
  "profile_version": "1.0.0",
  "id": "pulsify-shared-reference-replication",
  "date": "2026-10-08",
  "scope": {
    "carousel_images_individually_examined": 76,
    "usable_full_captures": 75,
    "broken_fragments": 1,
    "source_directories": 8,
    "visual_families": 9,
    "existing_story_audit_images": 57,
    "story_audit_reopened_this_pass": false,
    "live_app_integrated": false,
    "pixel_identity_guaranteed": false
  },
  "evidence_policy": {
    "observation": "Visible in supplied image",
    "inference": "Bounded interpretation of visual/narrative job",
    "production_rule": "Explicit founder direction or proposed engineering gate",
    "geometry": "Estimated starting coordinates; calibrate with original",
    "source_claims": "Attributed, not independently verified",
    "unknowns": [
      "exact source fonts",
      "layer files and many original photographs",
      "uninterrupted G2/G3 campaign order",
      "occluded/tiny UI labels",
      "donut segment values",
      "measured retention/conversion"
    ]
  },
  "precedence": [
    "current explicit job/founder/client decisions",
    "locked copy and banned asset registry",
    "mode and family",
    "selected image/recipe anchors",
    "estimated defaults"
  ],
  "modes": {
    "reference-study": "Preserve original reference look for internal calibration, source claims remain attributed",
    "client-production": "Preserve craft with real registered client assets, truthful copy and active brand overrides"
  },
  "invariants": [
    "copy and communication purpose before artwork",
    "preserve recognizable actual environment",
    "never globally blur or mirror/blur-extend for text space",
    "do not generate personal identity, receipts or final typography",
    "photo and mask share one exact transform",
    "essential text/units/timeframes/CTA remain visible",
    "real glyph assets identify apps; connections require separate authenticated records",
    "graphs declare conceptual/source-capture/measured status",
    "same craft for stories and carousels with separate geometry",
    "no hard gate can be offset by an aesthetic score"
  ],
  "pulsify_overrides": {
    "scope": "Current SaaS highlight; does not globally replace source-study palettes or app UI",
    "palette": {
      "graphite": "#0b0c0d",
      "warm_white": "#f1f1ee",
      "silver": "#efeee9",
      "red_underline": "#e5322d",
      "good_number_emerald": "#5fd6a4"
    },
    "fonts": [
      "registered Helvetica family; current local choice",
      "Georgia only when an approved serif role is wanted"
    ],
    "banned_photo_ids": [
      "9 / IMG_8529"
    ],
    "photo": "Natural scene and exposure; useful deliberate crop; no manufactured top fill",
    "brand": "Purposeful canonical coin; once/twice in current highlight, not watermark every frame",
    "no_saturated_blue_in_active_highlight": true
  },
  "formats": {
    "carousel": {
      "width": 1080,
      "height": 1350,
      "safe_box": [
        0.05,
        0.04,
        0.9,
        0.92
      ],
      "status": "proposed working 4:5 canvas; actual source aspect varies"
    },
    "story": {
      "width": 1080,
      "height": 1920,
      "safe_box": [
        0.05,
        0.13020833333333334,
        0.9,
        0.6927083333333334
      ],
      "status": "inherited active project reserves, not verified platform specification"
    },
    "adaptation": "Recompose photo, text, nodes and edges separately for each format; never stretch or blindly scale entire frame"
  },
  "layer_stack": [
    "base-photo",
    "approved-local-contrast",
    "rear-artwork",
    "original-photo-subject-restore",
    "critical-foreground-copy-labels",
    "annotations-brand-cta"
  ],
  "material_defaults": {
    "status": "Proposed 1080px-wide starting values; visually calibrate selected source, not exact recovered source parameters",
    "glass_pill": {
      "border_px": [
        1,
        2
      ],
      "radius_px": [
        18,
        32
      ],
      "background_opacity": [
        0.12,
        0.3
      ],
      "padding_px": [
        14,
        24
      ],
      "shadow": "subtle local lift, not background blur"
    },
    "dark_report": {
      "border_px": [
        0,
        1.5
      ],
      "radius_px": [
        16,
        28
      ],
      "background_opacity": [
        0.85,
        1
      ],
      "padding_px": [
        16,
        28
      ]
    },
    "graph_route": {
      "stroke_px": [
        2,
        4
      ],
      "corner_radius_px": [
        12,
        24
      ],
      "arrow_tip": "match named endpoint; route behind nonessential edges, essential labels in front"
    },
    "editorial_arrow": {
      "stroke_px": [
        2,
        5
      ],
      "curve": "explicit SVG cubic control points; subtle deliberate hand variation"
    },
    "marker_underline": {
      "stroke_px": [
        3,
        7
      ],
      "placement": "phrase baseline with a small gap; fitted actual rendered width"
    },
    "photo_depth": {
      "alpha": "Registered grayscale/RGBA source-sized mask",
      "transform": "same crop, scale, translation as base",
      "restore_rgb": "original photo pixels",
      "check": "hair/hands/furniture intersections at full size and zoom"
    },
    "type": {
      "side_margin_fraction": [
        0.05,
        0.07
      ],
      "standard_headline_px": [
        64,
        100
      ],
      "body_px": [
        34,
        46
      ],
      "status": "font/phrase dependent; phone readability overrides range"
    }
  },
  "raster_color_evidence": [
    {
      "reference_id": "G1-2",
      "role": "headline-accent",
      "normalized_region_xyxy": [
        0.02,
        0.02,
        0.98,
        0.3
      ],
      "method": "Most frequent 8-level RGB bins, saturation >= .2 and value >= .55; optional hue filter. Compressed raster samples, not native design tokens.",
      "candidates": [
        {
          "hex": "#ecacac",
          "qualifying_pixel_count": 64867
        },
        {
          "hex": "#fcbca4",
          "qualifying_pixel_count": 62326
        },
        {
          "hex": "#f4b4a4",
          "qualifying_pixel_count": 53250
        }
      ]
    },
    {
      "reference_id": "G1-3",
      "role": "headline-accent",
      "normalized_region_xyxy": [
        0.02,
        0.02,
        0.98,
        0.3
      ],
      "method": "Most frequent 8-level RGB bins, saturation >= .2 and value >= .55; optional hue filter. Compressed raster samples, not native design tokens.",
      "candidates": [
        {
          "hex": "#dca4b4",
          "qualifying_pixel_count": 71381
        },
        {
          "hex": "#e4acb4",
          "qualifying_pixel_count": 54753
        },
        {
          "hex": "#e4a4b4",
          "qualifying_pixel_count": 42260
        }
      ]
    },
    {
      "reference_id": "G1-4",
      "role": "headline-accent",
      "normalized_region_xyxy": [
        0.02,
        0.02,
        0.98,
        0.3
      ],
      "method": "Most frequent 8-level RGB bins, saturation >= .2 and value >= .55; optional hue filter. Compressed raster samples, not native design tokens.",
      "candidates": [
        {
          "hex": "#c48cc4",
          "qualifying_pixel_count": 40091
        },
        {
          "hex": "#d49cbc",
          "qualifying_pixel_count": 38118
        },
        {
          "hex": "#c494c4",
          "qualifying_pixel_count": 33796
        }
      ]
    },
    {
      "reference_id": "G1-5",
      "role": "headline-accent",
      "normalized_region_xyxy": [
        0.02,
        0.02,
        0.98,
        0.3
      ],
      "method": "Most frequent 8-level RGB bins, saturation >= .2 and value >= .55; optional hue filter. Compressed raster samples, not native design tokens.",
      "candidates": [
        {
          "hex": "#b484cc",
          "qualifying_pixel_count": 48622
        },
        {
          "hex": "#ac7cd4",
          "qualifying_pixel_count": 47156
        },
        {
          "hex": "#bc84cc",
          "qualifying_pixel_count": 30018
        }
      ]
    },
    {
      "reference_id": "G1-6",
      "role": "headline-accent",
      "normalized_region_xyxy": [
        0.02,
        0.02,
        0.98,
        0.3
      ],
      "method": "Most frequent 8-level RGB bins, saturation >= .2 and value >= .55; optional hue filter. Compressed raster samples, not native design tokens.",
      "candidates": [
        {
          "hex": "#a474dc",
          "qualifying_pixel_count": 44960
        },
        {
          "hex": "#9c74dc",
          "qualifying_pixel_count": 43216
        },
        {
          "hex": "#946ce4",
          "qualifying_pixel_count": 40806
        }
      ]
    },
    {
      "reference_id": "G1-7",
      "role": "headline-accent",
      "normalized_region_xyxy": [
        0.02,
        0.02,
        0.98,
        0.3
      ],
      "method": "Most frequent 8-level RGB bins, saturation >= .2 and value >= .55; optional hue filter. Compressed raster samples, not native design tokens.",
      "candidates": [
        {
          "hex": "#845cec",
          "qualifying_pixel_count": 54692
        },
        {
          "hex": "#8c64ec",
          "qualifying_pixel_count": 46915
        },
        {
          "hex": "#8c64e4",
          "qualifying_pixel_count": 42382
        }
      ]
    },
    {
      "reference_id": "G1-8",
      "role": "headline-accent",
      "normalized_region_xyxy": [
        0.02,
        0.02,
        0.98,
        0.3
      ],
      "method": "Most frequent 8-level RGB bins, saturation >= .2 and value >= .55; optional hue filter. Compressed raster samples, not native design tokens.",
      "candidates": [
        {
          "hex": "#6c4cfc",
          "qualifying_pixel_count": 83335
        },
        {
          "hex": "#7454f4",